{
  "schemaVersion": "2.0",
  "jobId": "11111111-1111-7111-8111-111111111111",
  "processingRunId": "22222222-2222-7222-8222-222222222222",
  "videoAssetId": "33333333-3333-7333-8333-333333333333",
  "cameraId": "44444444-4444-7444-8444-444444444444",
  "workerId": "gpu-sdd-01",
  "leaseToken": "AAAAAAAAAAAAAAAAAAAAAAAAAAAAAAAAAAAAAAAAAAA",
  "attemptCount": 1,
  "leaseExpiresAtUtc": "2026-09-09T02:32:00Z",
  "pipeline": "phase1-detection-tracking",
  "pipelineVersion": "phase1-v1",
  "sourceStorageKey": "source/44444444-4444-7444-8444-444444444444/2026/09/09/33333333-3333-7333-8333-333333333333.mp4",
  "sourceSha256": "aaaaaaaaaaaaaaaaaaaaaaaaaaaaaaaaaaaaaaaaaaaaaaaaaaaaaaaaaaaaaaaa",
  "sourceSizeBytes": 123456,
  "recordingStartUtc": "2026-09-09T01:30:00Z",
  "recordingEndUtc": "2026-09-09T01:31:00Z",
  "durationMs": 60000,
  "width": 1920,
  "height": 1080,
  "frameRateNumerator": 25,
  "frameRateDenominator": 1,
  "recordingTimeZoneId": "Asia/Kolkata",
  "recordingUtcOffsetMinutes": 330
}
